{
  "schema_version": "architecture-reference-geometry/1.0",
  "version": "0.1.0",
  "symbols": [
    {
      "symbol_id": "AR-WC",
      "category": "SANITARY",
      "representation": {
        "primitive": "SANITARY",
        "original": true
      },
      "parameters": {
        "width_m": {
          "required": true,
          "exclusive_minimum": 0
        },
        "depth_m": {
          "required": true,
          "exclusive_minimum": 0
        },
        "rotation_deg": {
          "required": true
        },
        "origin_m": {
          "required": true,
          "length": 2
        },
        "usage_clearance_m": {
          "required_for_fit_validation": true,
          "source_required": true
        },
        "dimension_basis": {
          "enum": [
            "MANUFACTURER",
            "OWNER_MEASURED",
            "VISUALIZATION_ONLY"
          ],
          "required": true
        }
      },
      "anchor": "rear-left footprint corner before rotation",
      "access_side": "front unless project-specific port/side evidence",
      "connection_side": "rear",
      "mep_ports": [
        {
          "system": "WASTE",
          "point": "PROJECT_OR_MANUFACTURER_INPUT_REQUIRED"
        },
        {
          "system": "WATER",
          "point": "PROJECT_OR_MANUFACTURER_INPUT_REQUIRED"
        }
      ],
      "collision_footprint": "Closed actual object outline; conservative rectangle until product outline supplied",
      "clearance_envelope": "Separate polygon; never equated to object footprint; unknown blocks fit approval",
      "normative_dimensions": null,
      "normative_source_rule_ids": [],
      "ergonomic_ranges": null,
      "ergonomic_source": null,
      "visualization_only": "Caller-supplied illustrative dimensions may draw but never certify fit",
      "cad_integration": {
        "block_name": "PLANHA_AR_WC",
        "units": "m",
        "layers": [
          "A-REF-OBJECT",
          "A-REF-USAGE",
          "A-REF-PORT"
        ],
        "identity": [
          "symbol_id",
          "catalog_hash",
          "parameter_hash",
          "instance_id",
          "build_identity"
        ],
        "placement": "No CAD INSERT until host and parameters validated; no third-party blocks"
      }
    },
    {
      "symbol_id": "AR-WALL_HUNG_WC",
      "category": "SANITARY",
      "representation": {
        "primitive": "SANITARY",
        "original": true
      },
      "parameters": {
        "width_m": {
          "required": true,
          "exclusive_minimum": 0
        },
        "depth_m": {
          "required": true,
          "exclusive_minimum": 0
        },
        "rotation_deg": {
          "required": true
        },
        "origin_m": {
          "required": true,
          "length": 2
        },
        "usage_clearance_m": {
          "required_for_fit_validation": true,
          "source_required": true
        },
        "dimension_basis": {
          "enum": [
            "MANUFACTURER",
            "OWNER_MEASURED",
            "VISUALIZATION_ONLY"
          ],
          "required": true
        }
      },
      "anchor": "rear-left footprint corner before rotation",
      "access_side": "front unless project-specific port/side evidence",
      "connection_side": "rear",
      "mep_ports": [
        {
          "system": "WASTE",
          "point": "PROJECT_OR_MANUFACTURER_INPUT_REQUIRED"
        },
        {
          "system": "WATER",
          "point": "PROJECT_OR_MANUFACTURER_INPUT_REQUIRED"
        }
      ],
      "collision_footprint": "Closed actual object outline; conservative rectangle until product outline supplied",
      "clearance_envelope": "Separate polygon; never equated to object footprint; unknown blocks fit approval",
      "normative_dimensions": null,
      "normative_source_rule_ids": [],
      "ergonomic_ranges": null,
      "ergonomic_source": null,
      "visualization_only": "Caller-supplied illustrative dimensions may draw but never certify fit",
      "cad_integration": {
        "block_name": "PLANHA_AR_WALL_HUNG_WC",
        "units": "m",
        "layers": [
          "A-REF-OBJECT",
          "A-REF-USAGE",
          "A-REF-PORT"
        ],
        "identity": [
          "symbol_id",
          "catalog_hash",
          "parameter_hash",
          "instance_id",
          "build_identity"
        ],
        "placement": "No CAD INSERT until host and parameters validated; no third-party blocks"
      },
      "manufacturer_example": {
        "manufacturer": "Duravit",
        "product": "D-Code251309",
        "width_m": 0.37,
        "depth_m": 0.54,
        "url": "https://www.duravit.co.uk/file/8a8a818d9227d0b10192290806020627.uk-en.0/d-code_brochure_2024_uk.pdf",
        "printed_page": 22,
        "access_date": "2026-10-05",
        "authority": "MANUFACTURER_PRODUCT_EXAMPLE_ONLY",
        "usage_clearance_m": null,
        "automatic_default": false
      }
    },
    {
      "symbol_id": "AR-SQUAT_WC",
      "category": "SANITARY",
      "representation": {
        "primitive": "SANITARY",
        "original": true
      },
      "parameters": {
        "width_m": {
          "required": true,
          "exclusive_minimum": 0
        },
        "depth_m": {
          "required": true,
          "exclusive_minimum": 0
        },
        "rotation_deg": {
          "required": true
        },
        "origin_m": {
          "required": true,
          "length": 2
        },
        "usage_clearance_m": {
          "required_for_fit_validation": true,
          "source_required": true
        },
        "dimension_basis": {
          "enum": [
            "MANUFACTURER",
            "OWNER_MEASURED",
            "VISUALIZATION_ONLY"
          ],
          "required": true
        }
      },
      "anchor": "rear-left footprint corner before rotation",
      "access_side": "front unless project-specific port/side evidence",
      "connection_side": "rear",
      "mep_ports": [
        {
          "system": "WASTE",
          "point": "PROJECT_OR_MANUFACTURER_INPUT_REQUIRED"
        },
        {
          "system": "WATER",
          "point": "PROJECT_OR_MANUFACTURER_INPUT_REQUIRED"
        }
      ],
      "collision_footprint": "Closed actual object outline; conservative rectangle until product outline supplied",
      "clearance_envelope": "Separate polygon; never equated to object footprint; unknown blocks fit approval",
      "normative_dimensions": null,
      "normative_source_rule_ids": [],
      "ergonomic_ranges": null,
      "ergonomic_source": null,
      "visualization_only": "Caller-supplied illustrative dimensions may draw but never certify fit",
      "cad_integration": {
        "block_name": "PLANHA_AR_SQUAT_WC",
        "units": "m",
        "layers": [
          "A-REF-OBJECT",
          "A-REF-USAGE",
          "A-REF-PORT"
        ],
        "identity": [
          "symbol_id",
          "catalog_hash",
          "parameter_hash",
          "instance_id",
          "build_identity"
        ],
        "placement": "No CAD INSERT until host and parameters validated; no third-party blocks"
      }
    },
    {
      "symbol_id": "AR-WASHBASIN",
      "category": "SANITARY",
      "representation": {
        "primitive": "SANITARY",
        "original": true
      },
      "parameters": {
        "width_m": {
          "required": true,
          "exclusive_minimum": 0
        },
        "depth_m": {
          "required": true,
          "exclusive_minimum": 0
        },
        "rotation_deg": {
          "required": true
        },
        "origin_m": {
          "required": true,
          "length": 2
        },
        "usage_clearance_m": {
          "required_for_fit_validation": true,
          "source_required": true
        },
        "dimension_basis": {
          "enum": [
            "MANUFACTURER",
            "OWNER_MEASURED",
            "VISUALIZATION_ONLY"
          ],
          "required": true
        }
      },
      "anchor": "rear-left footprint corner before rotation",
      "access_side": "front unless project-specific port/side evidence",
      "connection_side": "rear",
      "mep_ports": [
        {
          "system": "WASTE",
          "point": "PROJECT_OR_MANUFACTURER_INPUT_REQUIRED"
        },
        {
          "system": "WATER",
          "point": "PROJECT_OR_MANUFACTURER_INPUT_REQUIRED"
        }
      ],
      "collision_footprint": "Closed actual object outline; conservative rectangle until product outline supplied",
      "clearance_envelope": "Separate polygon; never equated to object footprint; unknown blocks fit approval",
      "normative_dimensions": null,
      "normative_source_rule_ids": [],
      "ergonomic_ranges": null,
      "ergonomic_source": null,
      "visualization_only": "Caller-supplied illustrative dimensions may draw but never certify fit",
      "cad_integration": {
        "block_name": "PLANHA_AR_WASHBASIN",
        "units": "m",
        "layers": [
          "A-REF-OBJECT",
          "A-REF-USAGE",
          "A-REF-PORT"
        ],
        "identity": [
          "symbol_id",
          "catalog_hash",
          "parameter_hash",
          "instance_id",
          "build_identity"
        ],
        "placement": "No CAD INSERT until host and parameters validated; no third-party blocks"
      },
      "manufacturer_example": {
        "manufacturer": "Duravit",
        "product": "D-Code03426500002",
        "width_m": 0.65,
        "depth_m": 0.485,
        "url": "https://www.duravit.com/en-en/products/all-series/d-code/",
        "access_date": "2026-10-05",
        "authority": "MANUFACTURER_PRODUCT_EXAMPLE_ONLY",
        "usage_clearance_m": null,
        "automatic_default": false
      }
    },
    {
      "symbol_id": "AR-VANITY",
      "category": "SANITARY",
      "representation": {
        "primitive": "SANITARY",
        "original": true
      },
      "parameters": {
        "width_m": {
          "required": true,